<?xml version="1.0" encoding="utf-8"?><!DOCTYPE subject SYSTEM "subject.dtd">
<subject Name="Test">
    <text> testfach</text>
    <lesson Name="lesson 1" finished="false" endtime="">
        <text>lesson 1 esfewf</text>
        <question Name="Question 1" finished="false" >
            <text>
                5*5=?
            </text>
            <answer isCorrect="true">
                25
            </answer>
            <answer isCorrect="false">
                5
            </answer>
            <answer isCorrect="false">
                -10
            </answer>
        </question>
    </lesson>
    <lesson Name="lesson 2" finished="false" endtime="">
        <text>lesson 2  sdfkueggkuzfugzeizl</text>
        <question Name="Frage 1" finished="false">
            <text>4!</text>
            <answer isCorrect="true">24</answer>
            <answer isCorrect="false">6</answer>
            <answer isCorrect="false">1243</answer>
        </question>
    </lesson>
    <lesson Name="Lesson 3" finished="false" endtime="">
        <text>lesson -1 sfgiuewiluh efwilugilzif iuuggiu f
        </text>
        <question Name="bhbhdd" finished="false">
            <text>bdhiviuer</text>
            <answer isCorrect="false">ew</answer>
            <answer isCorrect="true">-1</answer>
        </question>
    </lesson>
</subject>